No,Sifat,Nama Mata Kuliah,Kode,SKS
47.,MKW,"Persiapan Penelitian
(Preliminary research)",TKM25XXXXX,2
"Deskripsi Mata Kuliah (Course Description):
Mata kuliah ini dirancang untuk memfasilitasi mahasiswa magister Teknik Mesin
dalam melaksanakan penelitian secara mandiri di bawah bimbingan dosen.
Matakuliah ini merupakan bagian dari proses penyusunan tesis. Dalam perkuliahan
ini, mahasiswa bekerja untuk menyusun kajian pustaka dan merumuskan metode
penelitian. Bimbingan rutin oleh dosen pembimbing akan membantu mahasiswa
mencapai kemajuan dan menyelesaikan penelitian dengan baik.
Tujuan Pembelajaran (Course Objective):
Mahasiswa diharapkan mampu menunjukkan kemampuan dalam melakukan
tinjauan pustaka secara mendalam dan kritis, merumuskan dan menyempurnakan
permasalahan penelitian dan tujuan penelitian, serta menentukan metode dan alat",,,,
