No,Sifat,Nama Mata Kuliah,Kode,SKS
40.,MKP,"Refrigerasi dan Pompa Kalor
(Refrigeration and Heat Pump)",TKM2572108,3
"Deskripsi Mata Kuliah (Course Description):
Mata kuliah ini membahas prinsip dasar dan lanjutan dari sistem refrigerasi dan
pompa kalor, termasuk siklus termodinamika, pilihan refrigeran, komponen utama,
performa sistem, dan aplikasi lanjutan dalam industri dan bangunan. Kajian meliputi
sistem kompresi uap, absorpsi, ejection, dan teknologi terbaru seperti heat
transformer, refrigerasi magnetik dan pompa kalor CO₂ serta perkembangan terkini
dalam teknologi refrigerasi dan pompa kalor. Mahasiswa juga akan menganalisis
aspek keberlanjutan, efisiensi energi, dan dampak lingkungan, serta melakukan studi
kasus pada aplikasi dunia nyata.
Tujuan Pembelajaran (Course Objective):
1. Memberikan pemahaman mendalam tentang teori dan aplikasi sistem
refrigerasi dan pompa kalor.
2. Memberikan pemahaman mendalam dalam menganalisi, merancang,
mengevaluasi, dan mengoptimalkan sistem tersebut.
3. Memberikan pemahaman mendalam terhadap isu keberlanjutan, efisiensi
energi, dan pemilihan teknologi yang ramah lingkungan.
4. Memberikan pemahaman mendalam untuk riset dan pengembangan
dalam bidang thermal systems terkait pendinginan dan pemanasan.
Capaian Pembelajaran Lulusan (CPL) atau Student Outcomes (SO): A1, A3, dan B3
Materi Pembelajaran (Outline Syllabus):
Prinsip dasar sistem refrigerasi dan pompa kalor, Analisis siklus kompresi uap ideal
dan nyata, Refrigeran dan isu lingkungan, Komponen utama sistem refrigerasi dan
pompa kalor, Sistem refrigerasi multistage dan cascade, Sistem refrigerasi absorpsi,
adsorpsi, dan ejection, Pompa kalor dan aplikasinya, Analisis energi dan exergi
sistem, Perancangan dan optimasi sistem, Evaluasi ekonomi dan dampak lingkungan,
Studi kasus aplikasi industri dan bangunan, dan Tren dan inovasi teknologi refrigerasi
dan pompa kalor.
Metode Pembelajaran SCL yang dipilih (Methods of Delivery):
Klasikal luring/daring, diskusi, studi kasus, project
Metode Penilaian (Assessment Methods):
Tugas, Quiz, Project, UTS, UAS, Project.
Referensi (Reference):
1) ASHRAE. (2021). ASHRAE Handbook – Refrigeration. American Society of",,,,
