No,Sifat,Nama Mata Kuliah,Kode,SKS
21.,MKP,"Teknologi Pengelasan Lanjut
(Advanced Welding Technology)",TKM2272202,3
"Deskripsi Mata Kuliah (Course Description):
Mata kuliah Teknologi Pengelasan Lanjut berisi kelanjutan ilmu dasar mengenai
teknik pengelasan yang telah diajarkan di Program S1 Teknik Mesin. Pada tingkat
dasar tersebut, mahasiswa diperkenalkan dengan teknik dasar pengelasan,
perpindahan panas las, distorsi dan tegangan sisa, metalurgi las, cacat las, metode
NDT, dan sifat mekanis las. Pada mata kuliah Teknologi Pengelasan Lanjut,
pemahaman mahasiswa mengenai aplikasi teknis pengelasan serta hubungannya
dengan rekayasa material dan mekanika terapan akan lebih diperdalam.
Tujuan Pembelajaran (Course Objective):
Tujuan pembelajaran ini adalah memberi pemahaman teknologi las dan aplikasinya
di industri yang meliputi: (1) Pengenalan berbagai jenis teknik pengelasan di bidang
manufaktur, (2) Studi sifat weldability, metalurgi las, perpindahan panas las dan sifat
mekanis las dan (3) Aplikasi teknik pengelasan di bidang teknik mesin: perpipaan,
bejana tekan, konstruksi kapal, bangunan lepas pantai (off- shore) dll. Mata kuliah ini
mendukung kompetensi lulusan Prodi Magister di bidang rekayasa material dan
mekanika terapan.
Capaian Pembelajaran Lulusan (CPL) atau Student Outcomes (SO): A1, A3, dan B3
Metode Pembelajaran SCL yang dipilih (Methods of Delivery):
Classical, Case-based learning, Project-based learning
Metode Penilaian (Assessment Methods):
Tugas, Quiz, Project, UTS, UAS, Project.
Referensi (Reference):
1) Kou, S. (2020). Welding Metallurgy, third edition, John Willey & Sons, Inc.,
New York.
2) John C. Lippold. (2014). Welding Metallurgy and Weldability, John Willey &
Sons, New York.
3) Schell, F.R. and Matlock, B. (1984). Industrial Welding Procedures, Van
Nostrand Reinhold Company, New York.",,,,
